Name,Price
Crystal-studded satin pet collar,£ 400
Crystal-studded satin pet collar,£ 400
Woven nylon tape pet leash with crystals,£ 650
Crystal-studded satin dog harness,£ 720
Crystal-studded satin dog harness,£ 720
Crystal-studded satin pet collar,£ 400
Crystal-studded satin pet collar,£ 400
Nylon pet leash,£ 650
Studded brushed leather pet collar,£ 470
Crystal-studded suede pet collar,£ 470
Brushed leather pet collar,£ 360
Studded brushed leather pet collar,£ 470
Brushed leather pet leash,£ 520
Nylon dog raincoat with hood,£ 580
Nylon puffer dog coat with hood,£ 580
Wool and cashmere pet sweater,£ 540
Nylon pet collar,£ 310
Nylon pet leash,£ 580
Re-Nylon and Saffiano leather pet bag,"£ 2,200"
Brushed leather name tag for pet,£ 240
Nylon dog harness,£ 690
Nylon pet collar,£ 310
Re-Nylon and Saffiano leather pet bag,"£ 2,200"
Nylon dog raincoat with hood,£ 580
