Name,Price
Infusion d'Iris EDP 100 ml,£ 115
Infusion d'Iris Cedre EDP 100 ml,£ 115
Infusion d'Amande EDP 100 ml,£ 115
Infusion de Fleur D'Oranger EDP 100 ml,£ 115
Infusion de Mimosa EDP 100 ml,£ 115
Infusion de Rose EDP 100 ml,£ 115
Infusion de Vetiver EDP 100 ml,£ 115
Infusion de Mandarine EDP 100 ml,£ 115
Infusion d'Oeillet EDP 100 ml,£ 115
Luna Rossa Ocean EDT 100 ml,£ 80
Luna Rossa Ocean EDT 50 ml,£ 60
Prada Luna Rossa Carbon Edt 100 ml,£ 80
Prada Luna Rossa Carbon Edt 50 ml,£ 60
Prada Luna Rossa Sport Edt 100 ml,£ 80
Prada Luna Rossa Sport Edt 50 ml,£ 60
Prada Luna Rossa Edt 100 ml,£ 80
Prada Luna Rossa Edt 50 ml,£ 60
Prada Luna Rossa Black 50 ml,£ 65
Prada Luna Rossa Black EDP 100 ml,£ 85
L'Homme Prada Edt 150 ml,£ 100
L'Homme Prada Edt 50 ml,£ 60
L'Homme Prada L'Eau Edt 150 ml,£ 100
