Name,Price
Extreme-Tex stretch ski jacket,"£ 4,250"
Extreme-Tex stretch ski jumpsuit,"£ 3,750"
Extreme-Tex ski suit with straps,"£ 1,980"
Faction x Prada Linea Rossa Prodigy 1.0 skis,"£ 3,000"
GORE-TEX ski jacket,"£ 2,450"
Prada Linea Rossa snowboard,"£ 2,700"
Prada Linea Rossa for Oakley helmet - Size L,£ 550
Prada Linea Rossa snowboard,"£ 2,700"
Prada Linea Rossa by Oakley ski goggles,£ 480
Extreme-Tex ski jacket,"£ 3,950"
Faction x Prada Linea Rossa ski poles,£ 300
"GORE-TEX, leather and knit ski gloves",£ 540
Prada Linea Rossa snowboard,"£ 2,700"
Prada Linea Rossa by Oakley ski goggles,£ 480
Prada Linea Rossa snowboard,"£ 2,700"
"GORE-TEX, leather and knit ski mittens",£ 560
"GORE-TEX, leather and knit ski gloves",£ 670
Prada Linea Rossa by Oakley snow goggle,£ 480
